{
 "robot_id": "kuka_iisy8_R930",
 "identificazione": {
  "modello": "LBR iisy 8 R930",
  "costruttore": "KUKA"
 },
 "assi_controllati": 6,
 "limiti": {
  "A1": {
   "min": -185,
   "max": 185,
   "ampiezza": null,
   "unita": "deg"
  },
  "A2": {
   "min": -230,
   "max": 50,
   "ampiezza": null,
   "unita": "deg"
  },
  "A3": {
   "min": -150,
   "max": 150,
   "ampiezza": null,
   "unita": "deg"
  },
  "A4": {
   "min": -180,
   "max": 180,
   "ampiezza": null,
   "unita": "deg"
  },
  "A5": {
   "min": -110,
   "max": 110,
   "ampiezza": null,
   "unita": "deg"
  },
  "A6": {
   "min": -220,
   "max": 220,
   "ampiezza": null,
   "unita": "deg"
  }
 },
 "geometria": {
  "d1": {
   "valore": null,
   "unita": null,
   "source": null,
   "confidenza": 0.0,
   "nota": "non quotato nel disegno"
  },
  "a1": {
   "valore": null,
   "unita": null,
   "source": null,
   "confidenza": 0.0,
   "nota": "non quotato nel disegno"
  },
  "a2": {
   "valore": null,
   "unita": null,
   "source": null,
   "confidenza": 0.0,
   "nota": "non quotato nel disegno"
  },
  "a3": {
   "valore": null,
   "unita": null,
   "source": null,
   "confidenza": 0.0,
   "nota": "non quotato nel disegno"
  },
  "d6": {
   "valore": null,
   "unita": null,
   "source": null,
   "confidenza": 0.0,
   "nota": "non quotato nel disegno"
  }
 },
 "reach_dichiarato": 930,
 "note": null
}