{
 "robot_id": "yaskawa_gp8",
 "identificazione": {
  "modello": "MOTOMAN GP8",
  "costruttore": "Yaskawa Europe GmbH"
 },
 "assi_controllati": 6,
 "limiti": {
  "S": {
   "min": -170,
   "max": 170,
   "ampiezza": null,
   "unita": "deg"
  },
  "L": {
   "min": -65,
   "max": 145,
   "ampiezza": null,
   "unita": "deg"
  },
  "U": {
   "min": -70,
   "max": 190,
   "ampiezza": null,
   "unita": "deg"
  },
  "R": {
   "min": -190,
   "max": 190,
   "ampiezza": null,
   "unita": "deg"
  },
  "B": {
   "min": -135,
   "max": 135,
   "ampiezza": null,
   "unita": "deg"
  },
  "T": {
   "min": -360,
   "max": 360,
   "ampiezza": null,
   "unita": "deg"
  }
 },
 "geometria": {
  "d1": {
   "valore": 330,
   "unita": "mm",
   "source": {
    "testo_quota": "330",
    "posizione": "vista laterale, in basso a sinistra"
   },
   "confidenza": 0.9,
   "nota": null
  },
  "a1": {
   "valore": null,
   "unita": null,
   "source": null,
   "confidenza": 0.0,
   "nota": "non quotato nel disegno"
  },
  "a2": {
   "valore": null,
   "unita": null,
   "source": null,
   "confidenza": 0.0,
   "nota": "non quotato nel disegno"
  },
  "a3": {
   "valore": null,
   "unita": null,
   "source": null,
   "confidenza": 0.0,
   "nota": "non quotato nel disegno"
  },
  "d6": {
   "valore": null,
   "unita": null,
   "source": null,
   "confidenza": 0.0,
   "nota": "non quotato nel disegno"
  }
 },
 "reach_dichiarato": 727,
 "note": null
}