{
 "robot_id": "yaskawa_gp7",
 "identificazione": {
  "modello": "MOTOMAN GP7",
  "costruttore": "Yaskawa"
 },
 "assi_controllati": 6,
 "limiti": {
  "S": {
   "min": -170,
   "max": 170,
   "ampiezza": null,
   "unita": "deg"
  },
  "L": {
   "min": -65,
   "max": 145,
   "ampiezza": null,
   "unita": "deg"
  },
  "U": {
   "min": -70,
   "max": 190,
   "ampiezza": null,
   "unita": "deg"
  },
  "R": {
   "min": -190,
   "max": 190,
   "ampiezza": null,
   "unita": "deg"
  },
  "B": {
   "min": -135,
   "max": 135,
   "ampiezza": null,
   "unita": "deg"
  },
  "T": {
   "min": -360,
   "max": 360,
   "ampiezza": null,
   "unita": "deg"
  }
 },
 "geometria": {
  "d1": {
   "valore": null,
   "unita": null,
   "source": null,
   "confidenza": 0.0,
   "nota": "non presente nel disegno quotato"
  },
  "a1": {
   "valore": null,
   "unita": null,
   "source": null,
   "confidenza": 0.0,
   "nota": "non quotato nel disegno"
  },
  "a2": {
   "valore": null,
   "unita": null,
   "source": null,
   "confidenza": 0.0,
   "nota": "non presente nel disegno quotato"
  },
  "a3": {
   "valore": null,
   "unita": null,
   "source": null,
   "confidenza": 0.0,
   "nota": "non presente nel disegno quotato"
  },
  "d6": {
   "valore": null,
   "unita": null,
   "source": null,
   "confidenza": 0.0,
   "nota": "non presente nel disegno quotato"
  }
 },
 "reach_dichiarato": 927,
 "note": null
}